{
  "$schema": "https://json-schema.org/draft/2020-12/schema",
  "$id": "https://codevetter.com/schemas/agent-task/agent-adapter-v2.json",
  "type": "object",
  "additionalProperties": false,
  "required": [
    "schema_version",
    "adapter_id",
    "agent",
    "model",
    "configuration",
    "command",
    "artifacts",
    "environment_names",
    "timeout_ms",
    "cost_posture",
    "planning"
  ],
  "properties": {
    "schema_version": { "const": "codevetter.agent-task-adapter.v2" },
    "adapter_id": { "$ref": "./common.schema.json#/$defs/id" },
    "agent": { "type": "string", "minLength": 1, "maxLength": 120 },
    "model": { "type": "string", "minLength": 1, "maxLength": 160 },
    "configuration": { "type": "string", "minLength": 1, "maxLength": 160 },
    "command": {
      "type": "array",
      "minItems": 1,
      "maxItems": 50,
      "items": { "type": "string", "minLength": 1, "maxLength": 500 }
    },
    "artifacts": {
      "type": "array",
      "minItems": 1,
      "maxItems": 50,
      "items": { "$ref": "./common.schema.json#/$defs/artifact" }
    },
    "environment_names": {
      "type": "array",
      "maxItems": 30,
      "uniqueItems": true,
      "items": { "type": "string", "pattern": "^[A-Z][A-Z0-9_]{0,79}$" }
    },
    "timeout_ms": { "type": "integer", "minimum": 1000, "maximum": 3600000 },
    "cost_posture": { "enum": ["free", "paid", "unknown"] },
    "planning": {
      "type": "object",
      "additionalProperties": false,
      "required": [
        "prompt_overhead_tokens",
        "reserved_output_tokens",
        "input_usd_per_million",
        "output_usd_per_million",
        "max_cost_usd"
      ],
      "properties": {
        "prompt_overhead_tokens": { "type": "integer", "minimum": 0, "maximum": 1000000 },
        "reserved_output_tokens": { "type": "integer", "minimum": 1, "maximum": 1000000 },
        "input_usd_per_million": { "type": "number", "minimum": 0, "maximum": 100000 },
        "output_usd_per_million": { "type": "number", "minimum": 0, "maximum": 100000 },
        "max_cost_usd": { "type": "number", "minimum": 0, "maximum": 100000 }
      }
    },
    "diagnostics_path": { "$ref": "./common.schema.json#/$defs/relativePath" }
  }
}
